{"admin": {"country": "australia", "email": "research@apnic.net", "fax": "+61-7-3858-3199", "name": "APNIC RESEARCH", "postalCode": "4101", "state": "qld", "street": "po box 3646", "telephone": "+61-7-3858-3188"}, "billing": {}, "registrant": {"email": "helpdesk@apnic.net", "fax": "+61-7-38583199", "name": "APNIC Research and Development", "street": "6 cordelia st", "telephone": "+61-7-38583100"}, "tech": {"country": "australia", "email": "research@apnic.net", "fax": "+61-7-3858-3199", "name": "APNIC RESEARCH", "postalCode": "4101", "state": "qld", "street": "po box 3646", "telephone": "+61-7-3858-3188"}, "zone": {}, "nameServers": [], "contactEmail": "helpdesk@apnic.net", "domain": "1.1.1.0", "lastLoadedAt": "2022-08-25T16:35:33.171-07:00", "registered": "2011-08-10T16:12:35.000-07:00", "registrar": "APNIC", "registryUpdatedAt": "2020-07-15T06:10:57.000-07:00", "whoisServer": "rdap.apnic.net", "organization": "APNIC Research and Development", "name": "APNIC Research and Development", "telephone": "+61-7-38583100", "domainStatus": "active", "rawText": "IP Network: \n  Handle: 1.1.1.0 - 1.1.1.255\n  Start Address: 1.1.1.0\n  End Address: 1.1.1.255\n  IP Version: v4\n  Name: APNIC-LABS\n  Type: ASSIGNED PORTABLE\n  Country: AU\n  Port43: whois.apnic.net\n\n  Cidr: \n    Prefix: 1.1.1.0\n    Length: 24\n  Event: \n    Action: registration\n    Date: 2011-08-10T23:12:35Z\n  Event: \n    Action: last changed\n    Date: 2020-07-15T13:10:57Z\n    Status: active\n  Entity: \n    Handle: ORG-ARAD1-AP\n    Role: \n      REGISTRANT\n    VCard: \n      Formatted Name: APNIC Research and Development\n      Kind: org\n      Address: \n          Street: 6 cordelia st\n          LABEL: 6 Cordelia St\n      Telephone: +61-7-38583100\n          TYPE: voice\n      Telephone: +61-7-38583199\n          TYPE: fax\n      Email: helpdesk@apnic.net\n    Event: \n      Action: registration\n      Date: 2017-08-08T23:21:55Z\n    Event: \n      Action: last changed\n      Date: 2017-10-11T01:28:39Z\n    Link: \n      Rel: self\n      Value: https://rdap.apnic.net/entity/ORG-ARAD1-AP\n      Type: application/rdap+json\n      Href: https://rdap.apnic.net/entity/ORG-ARAD1-AP\n    Notice: \n      Title: Source\n      Description: \n        Objects returned came from source\n        APNIC\n    Notice: \n      Title: Terms and Conditions\n        Description: This is the APNIC WHOIS Database query service. The objects are in RDAP format.\n        Link: \n          Rel: terms-of-service\n          Value: https://rdap.apnic.net/entity/ORG-ARAD1-AP\n          Type: text/html\n          Href: http://www.apnic.net/db/dbcopyright.html\n    Notice: \n      Title: Whois Inaccuracy Reporting\n        Description: If you see inaccuracies in the results, please visit: \n        Link: \n          Rel: inaccuracy-report\n          Value: https://rdap.apnic.net/entity/ORG-ARAD1-AP\n          Type: text/html\n          Href: https://www.apnic.net/manage-ip/using-whois/abuse-and-spamming/invalid-contact-form\n    RDAP Conformance: \n      history_version_0\n      nro_rdap_profile_0\n      cidr0\n      rdap_level_0\n  Entity: \n    Handle: IRT-APNICRANDNET-AU\n    Role: \n      ABUSE\n    VCard: \n      Formatted Name: IRT-APNICRANDNET-AU\n      Kind: group\n      Address: \n          PO Box: po box 3646\n          Region: qld\n          Postal Code: 4101\n          Country: australia\n        LABEL: \n          PO Box 3646\n          South Brisbane, QLD 4101\n          Australia\n      Email: helpdesk@apnic.net\n      Email: helpdesk@apnic.net\n          PREF: 1\n    Event: \n      Action: registration\n      Date: 2011-04-12T17:56:54Z\n    Event: \n      Action: last changed\n      Date: 2021-03-09T01:10:21Z\n    Entity: \n      Handle: AR302-AP\n      Role: \n        ADMIN\n        TECHNICAL\n      VCard: \n        Formatted Name: APNIC RESEARCH\n        Kind: group\n        Address: \n          LABEL: \n            PO Box 3646\n            South Brisbane, QLD 4101\n            Australia\n        Telephone: +61-7-3858-3188\n            TYPE: voice\n        Telephone: +61-7-3858-3199\n            TYPE: fax\n        Email: research@apnic.net\n      Event: \n        Action: registration\n        Date: 2011-08-22T06:00:02Z\n      Event: \n        Action: last changed\n        Date: 2018-04-04T04:26:04Z\n      Link: \n        Rel: self\n        Value: https://rdap.apnic.net/entity/IRT-APNICRANDNET-AU\n        Type: application/rdap+json\n        Href: https://rdap.apnic.net/entity/AR302-AP\n    Remark: \n      Title: remarks\n        Description: helpdesk@apnic.net was validated on 2021-02-09\n    Link: \n      Rel: self\n      Value: https://rdap.apnic.net/entity/IRT-APNICRANDNET-AU\n      Type: application/rdap+json\n      Href: https://rdap.apnic.net/entity/IRT-APNICRANDNET-AU\n    Notice: \n      Title: Source\n      Description: \n        Objects returned came from source\n        APNIC\n    Notice: \n      Title: Terms and Conditions\n        Description: This is the APNIC WHOIS Database query service. The objects are in RDAP format.\n        Link: \n          Rel: terms-of-service\n          Value: https://rdap.apnic.net/entity/IRT-APNICRANDNET-AU\n          Type: text/html\n          Href: http://www.apnic.net/db/dbcopyright.html\n    Notice: \n      Title: Whois Inaccuracy Reporting\n        Description: If you see inaccuracies in the results, please visit: \n        Link: \n          Rel: inaccuracy-report\n          Value: https://rdap.apnic.net/entity/IRT-APNICRANDNET-AU\n          Type: text/html\n          Href: https://www.apnic.net/manage-ip/using-whois/abuse-and-spamming/invalid-contact-form\n    RDAP Conformance: \n      history_version_0\n      nro_rdap_profile_0\n      cidr0\n      rdap_level_0\n  Entity: \n    Handle: AR302-AP\n    Role: \n      TECHNICAL\n      ADMIN\n    VCard: \n      Formatted Name: APNIC RESEARCH\n      Kind: group\n      Address: \n          PO Box: po box 3646\n          Region: qld\n          Postal Code: 4101\n          Country: australia\n        LABEL: \n          PO Box 3646\n          South Brisbane, QLD 4101\n          Australia\n      Telephone: +61-7-3858-3188\n          TYPE: voice\n      Telephone: +61-7-3858-3199\n          TYPE: fax\n      Email: research@apnic.net\n    Event: \n      Action: registration\n      Date: 2011-08-22T06:00:02Z\n    Event: \n      Action: last changed\n      Date: 2018-04-04T04:26:04Z\n    Entity: \n      Handle: AH256-AP\n      Role: \n        ADMIN\n        TECHNICAL\n      VCard: \n        Formatted Name: APNIC Helpdesk\n        Kind: individual\n        Address: \n          LABEL: \n            6 Cordelia Street\n            South Brisbane\n            QLD 4101\n        Telephone: +61 7 3858 3188\n            TYPE: voice\n        Telephone: +61 7 3858 3199\n            TYPE: fax\n        Email: helpdesk@apnic.net\n      Event: \n        Action: registration\n        Date: 2010-02-17T04:52:01Z\n      Event: \n        Action: last changed\n        Date: 2011-08-22T04:55:07Z\n      Remark: \n        Title: remarks\n          Description: APNIC Helpdesk Services\n      Link: \n        Rel: self\n        Value: https://rdap.apnic.net/entity/AR302-AP\n        Type: application/rdap+json\n        Href: https://rdap.apnic.net/entity/AH256-AP\n    Link: \n      Rel: self\n      Value: https://rdap.apnic.net/entity/AR302-AP\n      Type: application/rdap+json\n      Href: https://rdap.apnic.net/entity/AR302-AP\n    Notice: \n      Title: Source\n      Description: \n        Objects returned came from source\n        APNIC\n    Notice: \n      Title: Terms and Conditions\n        Description: This is the APNIC WHOIS Database query service. The objects are in RDAP format.\n        Link: \n          Rel: terms-of-service\n          Value: https://rdap.apnic.net/entity/AR302-AP\n          Type: text/html\n          Href: http://www.apnic.net/db/dbcopyright.html\n    Notice: \n      Title: Whois Inaccuracy Reporting\n        Description: If you see inaccuracies in the results, please visit: \n        Link: \n          Rel: inaccuracy-report\n          Value: https://rdap.apnic.net/entity/AR302-AP\n          Type: text/html\n          Href: https://www.apnic.net/manage-ip/using-whois/abuse-and-spamming/invalid-contact-form\n    RDAP Conformance: \n      history_version_0\n      nro_rdap_profile_0\n      cidr0\n      rdap_level_0\n  Remark: \n    Title: description\n    Description: \n      APNIC and Cloudflare DNS Resolver project\n      Routed globally by AS13335/Cloudflare\n      Research prefix for APNIC Labs\n  Remark: \n    Title: remarks\n    Description: \n      ---------------\n      All Cloudflare abuse reporting can be done via\n      resolver-abuse@cloudflare.com\n      ---------------\n  Link: \n    Rel: self\n    Value: https://rdap.apnic.net/ip/1.1.1.1\n    Type: application/rdap+json\n    Href: https://rdap.apnic.net/ip/1.1.1.0/24\n  Link: \n    Rel: related\n    Value: https://rdap.apnic.net/ip/1.1.1.1\n    Type: text/html\n    Href: https://netox.apnic.net/search/1.1.1.0%2F24?utm_source=rdap&utm_medium=result&utm_campaign=rdap_result\n  Notice: \n    Title: Source\n    Description: \n      Objects returned came from source\n      APNIC\n  Notice: \n    Title: Terms and Conditions\n      Description: This is the APNIC WHOIS Database query service. The objects are in RDAP format.\n      Link: \n        Rel: terms-of-service\n        Value: https://rdap.apnic.net/ip/1.1.1.1\n        Type: text/html\n        Href: http://www.apnic.net/db/dbcopyright.html\n  Notice: \n    Title: Whois Inaccuracy Reporting\n      Description: If you see inaccuracies in the results, please visit: \n      Link: \n        Rel: inaccuracy-report\n        Value: https://rdap.apnic.net/ip/1.1.1.1\n        Type: text/html\n        Href: https://www.apnic.net/manage-ip/using-whois/abuse-and-spamming/invalid-contact-form\n  RDAP Conformance: \n    history_version_0\n    nro_rdap_profile_0\n    cidr0\n    rdap_level_0\n"}